Decisao,Relatorio,S108VO
9303-005.436,"Trata-se de Recurso Especial de divergência interposto pela Fazenda Nacional com fundamento no artigo 67 do Anexo II do Regimento Interno do Conselho Administrativo de Recursos Fiscais — CARF, aprovado pela Portaria MF 256, de 22 de junho de 2009, contra ao acórdão nº 3403-003.003, proferido pela 4º Câmara/3º Turma Ordinária do Conselho Administrativo de Recursos Fiscais, que decidiu em dar parcial provimento ao Recurso Voluntário, para que: 1) antes da incidência da multa de ofício, o excesso de valor apurado nos meses em que houve depósito em juízo a maior seja imputado aos meses em que o depósito foi considerado insuficiente pela fiscalização; e 2) seja excluída a incidência dos juros de mora sobre a multa de ofício na fase de liquidação do presente julgado.
Reproduzo, inicialmente, excerto do relatório da decisão de primeiro grau:
""Trata-se de auto de infração com ciência do contribuinte por via postal em 27/03/2007, lavrado para exigir a COFINS, multa de ofício e juros de mora em relação aos fatos geradores ocorridos no período compreendido entre outubro de 1999 e janeiro de 2007.
O acórdão da decisão recorrida, restou assim ementado:
ASSUNTO: OBRIGAÇÕES ACESSÓRIAS 
ASSUNTO: CONTRIBUIÇÃO PARA O FINANCIAMENTO DA SEGURIDADE SOCIAL COFINS
Período de apuração: 01/10/1999 a 01/01/2007
DIPJ. DCTF. CONFISSÃO DE DÍVIDA. NECESSIDADE DE LANÇAMENTO DE OFÍCIO.
A teor do Decreto-Lei nº 2.124/84 e das IN SRF 126/98 e 127/98, é legítimo o lançamento de ofício para a constituição de crédito tributário não declarado em DCTF, ainda que tenha sido informado na DIPJ.
DEPÓSITO EM JUÍZO. LANÇAMENTO POR HOMOLOGAÇÃO.
O depósito em juízo do tributo não aperfeiçoa o lançamento por homologação, pois não se confunde e nem configura o pagamento antecipado a que alude o art. 150, § 1º do CTN.
COFINS. BASE DE CÁLCULO. INCLUSÃO DO ICMS.
À luz do art. 12 do Decreto-Lei nº 1.598/77 e do art. 4º da IN SRF nº 51/78, o ICMS deve ser incluído na base de cálculo da COFINS, por integrar a receita bruta do contribuinte. 
INCONSTITUCIONALIDADE.
É vedado ao CARF negar vigência a acordo internacional, lei ou decreto em razão de arguição de inconstitucionalidade.
MULTA DE OFÍCIO E JUROS DE MORA.
Estando a penalidade e os encargos da mora expressamente previstos em lei, só cabe à autoridade administrativa e aos órgãos administrativos de julgamento verificarem a presença dos pressupostos de fato para sua inflição.
JUROS DE MORA. IMPOSSIBILIDADE DE INCIDÊNCIA SOBRE MULTA DE OFÍCIO.
Estando a penalidade e os encargos da mora expressamente previstos em lei, só cabe à autoridade administrativa e aos órgãos administrativos de julgamento verificarem a presença dos pressupostos de fato para sua inflição.
JUROS DE MORA. IMPOSSIBILIDADE DE INCIDÊNCIA SOBRE MULTA DE OFÍCIO.
Não incidem juros de mora sobre a multa de ofício, por carência de fundamento legal expresso.
Recurso provido em parte.
Não conformada com tal decisão, a Fazenda Nacional interpõe o presente Recurso, requerendo que seja admitido o apelo, em razão da divergência apontada, e, no mérito, lhe seja dado provimento para reformar, na parte objeto de irresignação, o r. acórdão hostilizado, reconhecendo-se a incidência de juros de mora, à taxa Selic, sobre a multa de ofício.
Para comprovar o dissenso jurisprudencial, foi apontado, como paradigmas, os Acórdãos n°s 9101-00.539 e CSRF/04-00.651. Em seguida, o recurso teve seguimento especialmente quanto a incidência de mora, á taxa SELIC, sobre a multa de ofício, nos termos do Despacho de Admissibilidade, fls. 803/804.
A Contribuinte apresentou contrarrazões ao Recurso da Fazenda Nacional, sustentando ser inadmissível a cobrança de juros sobre a multa em matéria tributária, é de se excluir, assim, os valores referentes ás multas da base de cálculo da taxa de juros aplicada, devendo incidir tão somente sobre o valor do tributo devido. 
É o relatório. 




",1
9303-005.843,"Trata-se de Recurso Especial de Divergência interposto tempestivamente pela Procuradoria da Fazenda Nacional - PFN contra o Acórdão nº 202-18.598, de 12/12/2007, proferido pela 2ª Câmara do então Segundo Conselho de Contribuintes, que fora assim ementado:
Assunto: Contribuição para o Financiamento da Seguridade Social - Cofins
Período de apuração: 01/02/1998 a 28/02/1998, 01/05/1998 a 31/05/1998, 01/12/1998 a 31/12/1998, 01/01/1999 a 30/06/1999, 01/08/1999 a 30/09/1999, 01/12/1999 a 31/08/2001, 01/10/2001 a 31/12/2001, 01/02/2002 a 31/12/2002
Assunto: Contribuição para o PIS/Pasep
Período de apuração: 01/02/1998 a 28/02/1998, 01/05/1998 a 31/05/1998, 01/12/1998 a 31/12/1998, 01/01/1999 a 30/06/1999, 01/08/1999 a 30/09/1999, 01/12/1999 a 31/08/2001, 01/10/2001 a 31/12/2001, 01/02/2002 a 30/11/2002
Ementa: PEDIDO DE DILIGÊNCIA OU PERÍCIA. INDEFERIMENTO. DESNECESSIDADE.
Indefere-se o pedido de diligência ou perícia que nada acrescentaria aos elementos constantes dos autos, considerados suficientes para o julgamento da lide.
COFINS E PIS. DECADÊNCIA. PRAZO.
O prazo para a Fazenda Pública constituir o crédito tributário referente à Cofins e ao PIS extingue-se em cinco anos, contados da ocorrência do fato gerador, conforme disposto no art. 150, § 4º, do CTN.
Precedentes da CSRF.
BASE DE CALCULO. AMPLIAÇÃO. ART. 3 2 DA LEI N2 9.718/98. INCONSTITUCIONALIDADE.
Ao julgar os Recursos Extraordinários nºs 346.084, 357.950, 358.273 e 390.840, em 09/11/2005, o Pleno do STF declarou a inconstitucionalidade do art. 3º, § 1º, da Lei n2 9.718/98, por entender que a ampliação da base de cálculo da contribuição para o PIS e da Cofins por meio de lei ordinária violou a redação original do art. 195, I, da Constituição Federal, ainda vigente ao ser editada a mencionada norma legal.
INCONSTITUCIONALIDADE. DECISÃO DO STF. EXTENSÃO ADMINISTRATIVA.
Nos termos do art. 42, parágrafo único, do Decreto n º 2.346/97, devem os órgãos julgadores, singulares ou coletivos, da Administração Fazenddria, afastar a aplicação da lei, tratado ou ato normativo federal, declarado inconstitucional pelo Supremo Tribunal Federal..
JUROS DE MORA. INCIDÊNCIA SOBRE A MULTA DE OFÍCIO. CABIMENTO. PREVISÃO LEGAL. ART. 161 DO CTN.
Não havendo previsão legal para a incidência da taxa Selic sobre a multa de oficio relativa a tributos vencidos a partir de 1º/01/1997, a partir do seu vencimento, cobram-se juros de mora de 1% ao mês, conforme disposto no art. 161 do CTN.
Recurso provido em parte.
Contra a decisão, a contribuinte interpôs embargos de declaração, que, apreciados, resultou no Acórdão nº 3301-001.787, de 19/03/2013 (fls. 1924/1926).
Irresignada, a PFN alega contrariedade à lei, quanto à exclusão da incidência da taxa Selic sobre a multa de oficio e da exclusão dos descontos obtidos e dos juros ativos. Quanto à exclusão das bases de cálculo das receitas de aplicações de curto prazo, das variações monetárias, dos tributos a recuperar, do crédito presumido de IPI e dos descontos e abatimentos, suscita divergência em relação ao que decidido nos Acórdãos nº 201-78.856, 201-78.802, 204-01.643, 201-80.227, 201-79.462, 201-79.759 e 201-78.700,
O exame de admissibilidade do recurso encontra-se às fls. 1763/1767.
Intimada, a contribuinte não apresentou contrarrazões ao recurso.
É o Relatório.
",1
9303-005.435,"Trata-se de Recurso Especial de Divergência interposto tempestivamente pela Procuradoria da Fazenda Nacional contra o Acórdão nº 3403-002.891, de 27/03/2014, proferido pela 3ª Turma da 4ª Câmara da Terceira Seção do CARF, que fora assim ementado:

ASSUNTO: IMPOSTO SOBRE PRODUTOS INDUSTRIALIZADOS - IPI
Data do fato gerador: 31/10/2004, 30/11/2004, 31/12/2004
NULIDADE. CERCEAMENTO DE DEFESA.
Tratando-se de lançamento de ofício dos saldos devedores de escrita que foram apurados pelo próprio contribuinte, não caracteriza nulidade a falta de quadros demonstrativos dos valores lançados.
DENÚNCIA ESPONTÂNEA.
A apresentação de DCTF após a ciência do termo de início de ação fiscal não caracteriza a denúncia espontânea.
FALTA DE RECOLHIMENTO.
A falta de recolhimento dos saldos devedores do livro de IPI rende ensejo ao lançamento de ofício com os consectários a ele inerentes.
COMPENSAÇÃO.
A teor do art. 74 da Lei nº 9.430/96, com as alterações introduzidas pela Lei nº 10.637/02, a compensação só tem existência jurídica se for declarada à Secretaria da Receita Federal.
ÔNUS DA PROVA.
Cabe ao contribuinte o ônus da prova dos fatos modificativos, impeditivos ou extintivos da pretensão fazendária.
JUROS DE MORA. IMPOSSIBILIDADE DE INCIDÊNCIA SOBRE MULTA DE OFÍCIO.
Não incidem juros de mora sobre a multa de ofício, por carência de fundamento legal expresso.

No Recurso Especial, por meio do qual pleiteou, ao final, a reforma do decisum, a Recorrente insurge-se contra a exclusão da exigência o crédito tributário resultante da incidência dos juros de mora sobre a multa de ofício. Alega divergência com relação ao que decidido nos Acórdãos CSRF nº 04-00.651 e 9101-001.539.
O exame de admissibilidade encontra-se às fls. 167/169.
Intimada, a contribuinte não apresentou contrarrazões ao recurso.
É o Relatório.
",1
