9303-005.293,"Trata-se de recurso especial de divergência interposto pela Contribuinte (fls. 6.893 a 6.909, e documentos às fls. 6.910 a 7.003) com fulcro nos artigos 64, inciso II e 67 e seguintes do Anexo II do Regimento Interno do Conselho Administrativo de Recursos Fiscais - RICARF, aprovado pela Portaria MF nº 343/15, meio pelo qual busca a reforma do Acórdão nº 3101-001.694 (fls. 6.827 a 6.845) proferido pela 1ª Turma Ordinária da 1ª Câmara da Terceira Seção de julgamento, em 16 de setembro de 2014, no sentido de dar parcial provimento ao recurso voluntário, para ajustar a base de cálculo considerando a taxa de câmbio vigente à data de ocorrência do fato gerador para conversão do valor. A decisão recebeu a seguinte ementa: 
ASSUNTO: CONTRIBUIÇÃO DE INTERVENÇÃO NO DOMÍNIO ECONÔMICO - CIDE
Período de apuração: 01/01/2007 a 31/12/2008
CIDE. INCIDÊNCIA. LICENÇA DE USO OU AQUISIÇÃO DE CONHECIMENTO TECNOLÓGICO. SERVIÇOS TÉCNICOS, DE ASSISTÊNCIA ADMINISTRATIVA E SEMELHANTES. ROYALTIES. PAGAMENTO, CREDITAMENTO. ENTREGA. EMPREGO OU REMESSA AO EXTERIOR.
A Contribuição de Intervenção no Domínio Econômico CIDE onera os valores pagos creditados, entregues, empregados ou remetidos, a cada mês, a residentes ou domiciliados no exterior, por licença de uso de conhecimentos tecnológicos, aquisição de conhecimentos tecnológicos, contratos que impliquem transferência tecnológica, serviços técnicos e de assistência administrativa e semelhantes, e royalties.
FATO GERADOR. DEFINIÇÃO POR DECRETO. IMPOSSIBILIDADE. RESERVA LEGAL.
Dispõe o Código Tributário Nacional, que somente a lei pode definir o fato gerador da obrigação tributária principal. O Decreto editado com a finalidade de regulamentá-la deve ser interpretado em conformidade com suas disposições.
CIDE. BASE DE CÁLCULO. IMPOSTO DE RENDA NA FONTE.
A base de cálculo da CIDE é o valor do serviço contratado, creditado e/ ou pago ao prestador no exterior. Inexiste amparo legal para a exclusão do Imposto de Renda Retido na Fonte (IRRF), em nome e por conta a licenciante, da base de cálculo desta contribuição.
CIDE. BASE DE CÁLCULO. CONVERSÃO EM MOEDA NACIONAL.
Para determinar a base de cálculo da contribuição, o valor em reais das transferências externas será apurado conforme determina o artigo 143 do CTN, ou seja, com base na taxa de câmbio do dia da ocorrência do fato gerador da obrigação.
ASSUNTO: PROCESSO ADMINISTRATIVO FISCAL
Período de apuração: 01/01/2007 a 31/12/2008
ALEGAÇÃO DE INCONSTITUCIONALIDADE. INCOMPETÊNCIA.
Nos termos da Súmula nº 2, o CARF não é competente para se pronunciar sobre a inconstitucionalidade de lei tributária.
ASSUNTO: NORMAS GERAIS DE DIREITO TRIBUTÁRIO
Período de apuração: 01/01/2007 a 31/12/2008
JUROS DE MORA SOBRE MULTA DE OFÍCIO. INCIDÊNCIA. 
O crédito tributário, quer se refira a tributo quer seja relativo à penalidade pecuniária, não pago no respectivo vencimento, está sujeito à incidência de juros de mora, calculado à taxa Selic até o mês anterior ao pagamento, e de um por cento no mês de pagamento.
Recurso Voluntário Provido em Parte
Na data de 22/12/2011, a Contribuinte foi cientificada da lavratura de Auto de Infração (fls. 6.383 a 6.390) para exigência de Contribuição de Intervenção no Domínio Econômico (CIDE) - Remessas ao Exterior referente ao período de janeiro de 2007 a dezembro de 2008. O lançamento decorre do entendimento da Fiscalização pela incidência da CIDE sobre os pagamentos efetuados ao exterior em contrapartida pelo uso ou exploração de direitos autorais sobre obra artística, exploração e transmissão de filmes, programas e eventos em televisão por assinatura, por terem natureza de royalties. Também é exigida a inclusão do IRRF (Imposto de Renda Retido na Fonte) na base de cálculo da referida contribuição. 
A impugnação apresentada pelo Sujeito Passivo (fls. 6.439 a 6.459), foi julgada improcedente, mantendo-se o lançamento fiscal na íntegra, conforme Acórdão nº 16-38.338 (fls. 6.652 a 6.671), proferido pela 9ª Turma da Delegacia da Receita Federal de Julgamento em São Paulo I (SP). Não resignado com a decisão, apresentou recurso voluntário (fls. 6.679 a 6.708), o qual foi parcialmente provido tão somente para ajustar a base de cálculo considerando a taxa de câmbio vigente à data de ocorrência do fato gerador para fins de conversão, nos termos do Acórdão nº 3101-001.694 (fls. 6.827 a 6.845), ora recorrido. 
Na sequência, a Contribuinte apresentou embargos de declaração (fls. 6.876 a 6.880) alegando contradição no julgado quanto à conclusão de que o Decreto nº 4.195/2002 não modificou a incidência da CIDE, os quais foram rejeitados por meio do despacho s/nº de 25/09/2015 (fls. 6.886 a 6.890). 
No ensejo, insurge-se a Contribuinte por meio de recurso especial (fls. 6.893 a 6.909, e documentos às fls. 6.910 a 7.003) suscitando divergência jurisprudencial com relação aos seguintes pontos: 
(a) não incidência da CIDE nos pagamentos ao exterior pela aquisição de conteúdo, subdividindo-se o tópico em: 
(a.1) natureza jurídica dos pagamentos, por não se caracterizarem como royalties, uma vez efetuados diretamente ao autor da obra; e 
(a.2) aplicação do art. 10 do Decreto nº 4.195/2002;
(a.3) impossibilidade de cobrança cumulativa da CIDE – Remessas ao Exterior e da Condecine; 
(b) não inclusão do IRRF na base de cálculo da CIDE; e 
(c) exigência dos juros de mora sobre a multa de ofício. 
Para comprovar o dissenso interpretativo, colacionou como paradigmas os acórdãos, respectivamente: (a) 303-35.834 e 301-34.753; (b) 3201-00.415; e (c) 9202-002.600. 
O recurso especial foi admitido parcialmente, tendo prosseguimento quanto à aplicação do Decreto nº 4.195/02 para não incidência da CIDE; impossibilidade de cobrança cumulativa da CIDE – Remessas ao Exterior e da Condecine; não inclusão do IRF na base de cálculo da CIDE e à exigência dos juros de mora sobre a multa de ofício, conforme Despacho s/nº, de 18 de dezembro de 2015 (fls. 7.010 a 7.015), proferido pelo Ilustre Presidente da 1ª Câmara da Terceira Seção de Julgamento em exercício à época, e confirmado em sede de reexame de admissibilidade (fls. 7.016 a 7.017). Foi entendido como não comprovada a divergência jurisprudencial com relação ao enquadramento ou não dos pagamentos realizados para o exterior no conceito de royalties. 
No que tange aos tópicos do recurso especial que tiveram prosseguimento, a Recorrente sustentou, em síntese, que:
(a) a diferença entre os conceitos de direitos autorais e royalties confirma-se pelo Decreto nº 4.195/02, publicado com a finalidade de regulamentar a CIDE, tendo-o feito nos exatos limites da Lei nº 10.168/00; 
(b) nos termos do art. 10 do Decreto nº 4.195/02, são passíveis de tributação apenas os contratos que tenham por objeto o fornecimento de tecnologia ou a utilização de conhecimento tecnológico, como é o caso dos serviços técnicos de sessão de marcas e patentes. Não estão contemplados no Decreto os direitos autorais, no caso em análise decorrente de mera cessão do direito de transmitir determinado conteúdo em canais de televisão por assinatura, estando direitos autorais fora do campo de incidência da CIDE; 
(c) a melhor interpretação a ser dada ao art. 10 do Decreto nº 4.195/02 é de que o mesmo é taxativo, por prestigiar a referibilidade e assegurar a adequação entre o fato gerador e a incidência da CIDE, conservando-se a lógica interna e a utilidade do ato normativo;
(d) os pagamentos efetuados pela Recorrente constituem-se em remuneração por direito autoral e não royalties, razão pela qual estão sujeitos ao recolhimento da CONDECINE, a qual, assim como a CIDE-royalties, é uma contribuição de intervenção no domínio econômico, no entanto, voltada para o setor cinematográfico e videofonográfico, guardando referibilidade com o setor audiovisual, enquanto a CIDE-royalties tem referibilidade com o setor de tecnologia;
(e) ainda que se admitisse que as operações tributadas pela CONDECINE são potencialmente também tributáveis pela CIDE-royalties, a cobrança da segunda deve ser afastada para prevalecer apenas o gravame mais específico; 
(f) no que tange à inclusão do IRF na base de cálculo da CIDE nos pagamentos efetuados para as programadoras estrangeiras, não é necessário que haja lei prevendo a sua exclusão;
(g) o IRF não compõe o valor pago, entregue, empregado ou remetido para o exterior, que é justamente a base de cálculo da CIDE; constitui-se, outrossim, em parcela de recursos já transferida para o Poder Público, não sendo justificável a sua tributação pela CIDE;
(h) por fim, requer o afastamento da incidência dos juros de mora pela taxa Selic sobre a multa de ofício em exigência, pois essa penalidade não se enquadra no conceito de crédito tributário estabelecido no art. 161 do CTN. 
A Fazenda Nacional apresentou contrarrazões (fls. 7.019 a 7.033) postulando, preliminarmente, o não conhecimento do recurso especial e, no mérito, a negativa de provimento.
O presente processo foi distribuído a essa Relatora por meio de sorteio regularmente realizado, estando apto o feito a ser relatado e submetido à análise desta Colenda 3ª Turma da Câmara Superior de Recursos Fiscais - 3ª Seção de Julgamento do Conselho Administrativo de Recursos Fiscais - CARF.
É o Relatório. 









",1
