3301-004.056,"Foi emitido Despacho Decisório (fls. 1.115 a 1.117), instruído por relatório titulado ""Informação Fiscal"" (fls. 1.067 a 1.114), por meio do qual foi indeferido o Pedido de Ressarcimento (PER) nº 36560.03972.290110.1.5.10-0843, no montante de R$ 4.622.855,38, em razão de glosa de créditos da Contribuição para o PIS/PASEP, vinculados `a receita de exportação do 4° trimestre de 2009. 
Outrossim, não foram homologados seis Pedidos de Compensação (DCOMP - fl. 1.116) no total de R$ 4.622.855,38, que redundou na lavratura de auto de infração para a cobrança de multa isolada, tratado no processo n° 11516.733510/2014-51, que encontra-se na pauta para julgamento nesta reunião.
Por conta das glosas efetuadas, foram alterados os valores utilizados para desconto dos débitos informados em DACON, sendo consumidos todos os créditos disponíveis e restando saldo a pagar, o qual foi lançado através do auto de infração, tratado no processo nº 11516.722481/2014-28, que também se encontra na pauta para julgamento nesta reunião.
Adoto o trecho da decisão recorrida que trata do relatório fiscal:
""(. . .)
No relatório fiscal, a autoridade fiscal informa: os processos nºs 11516.722481/2014-28, 10983.911358/2011-68, 10983.911355/2011-24, 10983.911352/2011-91, 10983.911360/2011-37, tratam da mesma matéria fática, divididos apenas por razões processuais em processos de ressarcimento e processos de auto de infração de cada trimestre, e que, portanto, devem ser analisados em conjunto, por trimestre; os autos de infração para exigência de multa isolada devida pela não homologação das compensações, foram tratados nos processos números 11516.722503/2014-50, 11516.722502/2014-13, 11516.722510/2014-51, 11516.722509/2014-27.
Após descrever o procedimento fiscal, passa a identificar as glosas realizadas conforme as linhas do Dacon, como segue.
1. Ficha 16A do Dacon - Aquisições no Mercado Interno
Da base de cálculo dos créditos apurados em Dacon, Ficha 16A –, foram glosados os valores que seguem:
1.1. Linha 01 – Bens para Revenda
Foram glosados:
1.1.1. os valores das aquisições de bens sujeitos a alíquota zero, listadas na planilha NT - Notas Fiscais Glosadas Alíquota zero;
1.1.2. os valores dos bens que não se enquadram no conceito de insumo, conforme o art. 8º, §4º, inc. I, alínea “a” da Instrução Normativa SRF nº 404/2004, listados na planilha NI - Notas Fiscais Glosadas que não representam Aquisição de Insumos.
1.2. Linha 02 – Bens Utilizados como Insumo
Da linha 02 foram glosados os valores referentes a:
1.2.1. aquisições de bens que não se enquadram no conceito de insumo, conforme o art. 8º, §4º, inc. I, alínea “a” da Instrução Normativa SRF nº 404/2004, listados na planilha NI - Notas Fiscais Glosadas que não representam Aquisição de Insumos;
1.2.2. aquisições de bens utilizados como insumos e sujeitos à alíquota zero; cada uma das notas fiscais glosadas está especificada na listagem NT - Notas Fiscais Glosadas Alíquota zero;
1.2.3. notas fiscais cujo Código Fiscal de Operação (CFOP) não representa aquisição de insumos e nem outra operação com direito a crédito; cada uma das notas fiscais glosadas está especificada na listagem CFOP - Notas Fiscais Glosadas - Operações sem direito a credito;
1.2.4. notas fiscais que representam aquisições de insumos de pessoas jurídicas e que deveriam ter ocorrido com suspensão obrigatória de PIS/Pasep e Cofins; cada uma das notas fiscais glosadas está especificada na listagem SUSPENSÃO - Notas Fiscais Glosadas Aquisição PJ – Suspensão obrigatória;
1.2.5. notas fiscais de aquisição de serviços de fretes e carretos lançados na Linha 2 do Dacon sem a identificação e CNPJ do fornecedor ou prestador dos serviços; cada uma das notas fiscais glosadas está especificada na planilha SEM Identificação - Notas Fiscais Glosadas sem identificação do Fornecedor.
1.3. Linha 03 - Serviços Utilizados como Insumo
1.3.1. notas fiscais cujo Código Fiscal de Operação (CFOP) não representa aquisição de insumos e nem outra operação com direito a crédito; cada uma das notas fiscais glosadas está especificada na listagem CFOP - Notas Fiscais Glosadas - Operações sem direito a credito;
1.3.2. aquisições de serviços que não se enquadram no conceito de insumo, conforme o art. 8º, §4º, inc. I, alínea “b” da Instrução Normativa SRF nº 404/2004, tais como SERVICO MANUTENCAO EQUIP INFORMATICA, SERVICO LIMPEZA GERAL EM INSTALACOES, SERVICO TREINAMENTO e SERVICO DE COPIA E IMPRESSÃO; cada uma das notas fiscais glosadas está especificada na planilha NI - Notas Fiscais Glosadas que não representam Aquisição de Insumos.
1.4. Linha 05 – Despesas de Aluguéis de Prédios Locados de Pessoa Jurídica
Foram glosadas as diferenças entre os valores informados no Dacon e os valores comprovados por meio da memória de cálculo apresentada pela contribuinte.
1.5. Linha 06 – Despesas de Aluguéis de Máquinas e Equipamentos Locados de Pessoa Jurídica
Foram glosadas:
1.5.1. as diferenças entre os valores informados no Dacon e os valores comprovados por meio da memória de cálculo apresentada pela contribuinte;
1.5.2. os valores relativos a ALUGUEIS DE VEICULOS, ALUGUEL PALCO EVENTOS E SERVIÇO DE LOCAÇÃO E MANUTENÇÃO DE SOFTWARE, estes, por não se enquadram no art. 3º, inciso IV, da Lei nº 10.833/2003, que somente contempla “aluguéis de máquinas e equipamentos, pagos à pessoa jurídica, utilizados nas atividades da empresa”. Cada uma das notas fiscais glosadas está especificada na planilha NI - Notas Fiscais Glosadas que não representam Aquisição de Insumos.
1.6. Linha 07 – Despesas de Armazenagem e Fretes na Operação de Venda
Foram glosadas:
1.6.1. as despesas com fretes em relação aos quais a interessada, apesar de intimada e reintimada para tanto, não logrou apresentar a vinculação com as vendas efetuadas, de modo a possibilitar a confirmação das exigências legais para o creditamento. Cada uma das notas fiscais glosadas está especificada na FVNC - Fretes de Vendas Não Comprovados;
1.6.2. notas fiscais cujo Código Fiscal de Operação (CFOP) não representa aquisição de insumos e nem outra operação com direito a crédito; cada umadas notas fiscais glosadas está especificada na listagem CFOP - Notas Fiscais Glosadas - Operações sem direito a credito.
2. Ficha 16A – CRÉDITOS PRESUMIDOS ATIVIDADES AGROINDUSTRIAIS
Linha 25 – Calculados sobre Insumos de Origem Animal
Linha 26 – Calculados sobre Insumos de Origem Vegetal
A autoridade fiscal relata que a contribuinte lançou nas linhas 25, 26 e 27 (Ajustes Positivos de Crédito) o crédito presumido de sua atividade agroindustrial - Lei nº 10.925/2004 e nº Lei 12.058/2009 -, conforme resposta ao Termo de Intimação Fiscal nº 001/00555 (fls. 525), presente neste processo a fls. 562 e seguintes, e informa que, dos dados apresentados nas planilhas citadas no item b da referida intimação (planilha com a composição dos valores informados na linha 27 das fichas 06A e 16A ), verifica-se que, apesar de citar os artigos 32 e 33, a contribuinte apurou na linha 27 apenas os créditos previstos no art. 34 da lei 12.058/2009.
Traz em seu relatório a listagem dos insumos adquiridos com o benefício do crédito presumido - da Lei nº 10.925/2004 e da nº Lei 12.058/2009 - que sofreram alteração de alíquotas e glosa, totalizados por descrição em cada mês e informa que as notas fiscais cujos valores foram glosados estão devidamente individualizadas no arquivo não paginável denominado CREDITO PRESUMIDO-detalhe-BRF-2009-04-trim.xlsx anexado a este processo. Informa que foram realizados os seguintes ajuste:
a) glosa das operações que não configuram aquisições de insumos com qualquer crédito presumido. Nesta categoria se incluem aquisições de produtos industrializados, aquisições de quaisquer bens para revenda ou aquisições para entrega futura. Estas situações estão corrigidas para alíquota zero de crédito presumido nas listagens anexas e nos resumos acima;
b) as aquisições de bens de origem vegetal ou animal, mas não classificadas nas posições da NCM listadas no art. 8º da Lei 10.925/2004, enquadrados, portanto, no §3º, inc III do citado artigo, tiveram a alíquota corrigida para 2,66% para a Cofins e 0,5775% para o PIS/Pasep;
c) as aquisições de soja e seus derivados, enquadradas na Lei 10.925/2004, art. 8º, §3º, inc. II e aquisições de bovinos vivos da posição 01.02 da NCM, enquadradas na Lei nº 12.058/2009, art. 33, §3º, tiveram a alíquota corrigida para 3,8% para a Cofins e 0,825% para o PIS/Pasep;
d) as aquisições de bens de origem animal, enquadradas na Lei 10.925/2004, art. 8º, §3º, inc. I, que embora estivessem com a alíquota correta, 4,56% para a Cofins e 0,99% para o PIS/Pasep, tiveram os valores de crédito corrigidos porque o valor constante da planilha do contribuinte não correspondia à multiplicação da alíquota pela base de cálculo; 
e) os valores informados na linha 27 (Ajuste Positivos de Créditos) foram glosados porque a empresa não faz jus ao crédito presumido do art. 34 da Lei nº 12.058/2009, tendo em vista o § 1º daquele artigo
3. Ficha 16B - Aquisições de Insumos no Mercado Externo
3.1. Linha 01 – Bens para Revenda
Foram glosados os valores das aquisições de bens cujo CFOP não representa aquisição de insumos.
3.2. Linha 02 – Bens Utilizados como Insumo
Foram glosados os valores referentes a:
3.2.1. Aquisições de bens cujo CFOP não representa aquisição de insumos; cada uma das notas fiscais glosadas está especificada na listagem CFOP - Notas Fiscais Glosadas - Operações sem direito a credito
3.2.2. Aquisições de bens sujeitos à alíquota zero da contribuição; cada uma das notas fiscais glosadas está especificada na listagem NT - Notas Fiscais Glosadas Alíquota zero.
Da manifestação de inconformidade
Inicialmente, a recorrente requer a reunião do presente processo aos processos nºs 10983.911358/2011-68, 10983.911355/2011-24, 10983.911352/2011-91, 11516.722502/2014-13, 11516.722503/2014-50, 11516.722509/2014-27, 11516.722510/2014-51 e 11516.722481/2014-28.
Suscita a nulidade do procedimento fiscal alegando, em síntese, cerceamento do direito de defesa e ofensa ao princípio da motivação ante a “fundamentação precária do despacho decisório”. Reclama que a fiscalização indicou o motivo das glosas através de siglas, “igualmente repetidas para cada item” e que não é “razoável” que esta se limite a justificar sua glosa alegando tão somente que os mesmos não se enquadram na definição de ""insumos"" trazida pela IN SRF nº 404/04, sem tecer quaisquer considerações sobre o processo produtivo da empresa. Nesse sentido, defende, em síntese, que cabia ao fisco “ter aprofundado a análise do emprego do insumo no processo produtivo da requerente” e dizer o motivo de cada glosa indicada na listagem de glosas.
A fim de afastar o conceito de insumo adotado pela Fiscalização, e defender que a palavra ""insumo"", empregada pelas Leis n° 10.637/2002 e n° 10.833/2003, possui abrangência muito maior do que pretende lhe dar a RFB, nas Instruções Normativas SRF nº 247, de 11/11/2002, e nº 404, de 12/3/2004, tece considerações sobre a não cumulatividade das contribuições em tela estabelecendo o seu entendimento sobre o conceito de insumo aplicável ao caso, à luz da interpretação que faz da legislação, da jurisprudência e da doutrina. Conclui, então, que o conceito de insumos empregado pelas referidas lei é amplo, “alcançando todos os custos, despesas e encargos vinculados ao produto vendido, ainda que incorridos após a fase de produção, mas que com ele se relacionem, e não apenas aqueles previstos nos atos fazendários”. 
Traz a descrição das atividades produtivas da empresa e, na sequência, passa a discorrer especificamente sobre cada tipo de glosa.
Bens adquiridos para revenda
Em relação às glosas das aquisições de Bens adquiridos para revenda, aduz que a fiscalização equivocou-se ao glosar créditos apurados nos termos do inciso I do art. 3º da Lei nº 10.833/03 sob o fundamento de que os itens considerados na base de cálculo “não estariam enquadrados no conceito de insumo contido na IN SRF n. 404/04”. Diz que a fiscalização confundiu os incisos I e II do art. 3º e alega que a tomada de créditos nos termos do inciso I exige tão somente que os bens sejam adquiridos para posterior revenda, não havendo qualquer vinculação da tomada do crédito com o conceito de insumo.
Bens e serviços utilizados como insumo
Inicialmente a Recorrente menciona que ficou demonstrado que a ausência de uma investigação mais aprofundada dos fatos, aliada à equivocada fundamentação jurídica, levou a fiscalização a glosar indevidamente diversos itens usados diretamente na produção, muitos deles podendo ser classificados, inclusive, como matéria-prima, produtos intermediários e materiais de embalagem.
Em relação aos itens glosados por não consistirem de insumos, diz que “não irá proceder a uma justificação individuada de cada um deles”, que se aterá a “fazer observações adicionais pontuais, sobre alguns dos mais relevantes”. Assim segue.
Em relação aos Pallets, explica que são utilizados em diversas etapas do processo produtivo, uma vez que
""(...) são usados na própria industrialização, para a movimentação das matérias-primas e dos produtos em fase de industrialização, evitando seu contato direto com o solo, diminuindo o risco de contaminação.
Os pallets também garantem a segurança na movimentação das cargas, permitem a mecanização e levantamento dos produtos e cargas nele transportados, mas, principalmente, possibilita a unitização de todo um quantitativo de produtos e de matérias primas entre fornecedores e a requerente e entre as diversas etapas da produção.""
Menciona que a jurisprudência do CARF reconhece o direito ao crédito quanto aos pallets, na qualidade de insumo.
No título Serviços utilizados como insumo, a interessada defende que dão direito ao crédito os serviços relacionados com a movimentação dos produtos e matérias-primas nas diversas etapas da produção, os quais foram glosados; cita como exemplo: serviços de repaletização e reforma de pallets; serviços de aplicação de strecht nos pallets; serviços de carga e descarga; serviços de montagem dos equipamentos usados na produção; bem como os serviços de manutenção dos mesmos, dentre outros. Também defende o direito ao crédito em relação aos custos com serviços de transporte de matérias-primas e de produtos adquiridos como insumos, bem como seu transporte do fornecedor até à empresa e seu deslocamento durante a fase de produção alegando que o CARF os reconhece como custo de produção. 
No título Partes e peças de reposição, combustíveis e lubrificantes defende o crédito em relação as despesas com a aquisição de peças de reposição de máquinas e equipamentos, dentre outros instrumentos utilizados na produção, além dos serviços para a sua manutenção e dos combustíveis e lubrificantes necessários ao funcionamento das máquinas e equipamentos, alegando que próprio fisco reconhece que são também passíveis de creditamento; cita a Solução de Consulta nº 9, de 12/01/2012, da 9ª Região Fiscal, Solução de Consulta nº 11, de 27/1/2011, da 8ª Região Fiscal; Solução de Consulta nº 520, de 26/10/2004, da 7ª Região Fiscal; Solução de Divergência COSIT nº 14, de 31/10/2007.
A Recorrente defende o direito a crédito em relação “todos os gastos realizados na produção da requerente que sejam decorrentes de exigências legais”. No item Serviços e produtos decorrentes de exigências legais, alega, em síntese, que existem normas do Poder Público que impõe procedimentos de higiene dentro da área fabril, bem como a utilização de equipamentos de proteção individual e também o controle e manutenção da segurança sanitária, cujo descumprimento ensejaria a “inviabilização da própria atividade, não estando a critério da requerente furtar-se ou não a estes gastos”. Defende o crédito em relação: - aos serviços aplicados e à aquisição de produtos utilizados na higienização das dependências do setor fabril, das máquinas da produção e do pessoal que lá trabalha; - à aquisição de uniformes e equipamentos de proteção individual; - aos serviços de análises físicoquímicas e laboratoriais.
No mesmo tópico defende o crédito em relação às aquisições de: “Equipamentos como facas, brincos de marcação para suínos e produtos químicos usados em diversas etapas da produção são exemplos de exigências das normas reguladoras às quais a requerente não pode deixar de se submeter”; equipamentos usados na atividade, que embora não sejam os de uso ordinário, igualmente devem obedecer as especificações dos órgãos reguladores; carimbos de marcação que seguem os padrões impostos pelo Poder Público.
Já no tópico Outros itens, a Recorrente diz que “não é possível proceder a uma análise minuciosa, trazendo detalhes de cada item listado pela fiscalização”, mas aduz que “confia que a descrição de suas atividades, em todo seu processo produtivo, permita esclarecer o seu direito ao crédito face à natureza dos bens elencados nos autos”
Hipótese de bens adquiridos com suspensão
Em relação às aos bens adquiridos com suspensão, a interessada alega que a fiscalização equivocou-se ao realizar as glosas dos itens listados, isto porque, segundo alega, os créditos apurados no período em questão, e glosados pela fiscalização sob a rubrica ""bens utilizados como insumos"", não são relativos à operações sujeitas à apuração do crédito presumido (art. 8o da Lei n. 10925/04) nem, tampouco, à suspensão (art. 9o da referida lei).
Crédito presumido da agroindústria
No que se refere ao crédito presumido da agroindústria previsto no art. 8º da Lei n° 10.925/2004, a interessada alega que o método para o cálculo do crédito presumido, conforme seu parágrafo 3º, está vinculado à natureza do produto desenvolvido pela empresa adquirente do insumo e titular do direito de crédito. Afirma que o parágrafo 10, do art. 8º, da Lei n° 10.925/2004, incluído pela Lei nº 2.865/2013, confirma exatamente a interpretação que sustenta. E acrescenta que é esse o entendimento adotado pelo CARF. 
Quanto ao crédito presumido previsto no art. 33 da Lei n. 12.058/2009, alega que o entendimento da Autoridade Fiscal de que as aquisições para revenda não geram esse tipo crédito não seria a interpretação correta do dispositivo. Afirma que, na redação vigente à época dos fatos, não há qualquer restrição para apuração do crédito presumido sobre a revenda; defende que para a apuração do referido crédito presumido exigia-se: (i) ser pessoa jurídica que produza mercadorias classificadas nos códigos 02.01, 02.02, 02.06.10.00, 02.06.20, 02.06.21, 02.06.29, 05.06.90.00, 05.10.00.10, 15.02.00.1, 41.01.20.10, 41.04.11.24 e 41.04.41.30 da NCM; (ii) que as mercadorias fossem destinadas à exportação; (iii) que os créditos presumidos fossem apurados sobre as aquisições de bens classificados na posição 01.02 da NCM; e (iv) que tais bens fossem adquiridos de pessoa física ou recebidos de cooperado pessoa física.
Acrescenta que, ademais, que no seu caso, não há simples revenda de mercadorias ao exterior. Pois os produtos classificados na posição 01.02 da NCM (""BOI VIVO"") foram transformados em outros produtos derivados, tais como cortes in natura, sebo, aproveitamento de couro, dentre outros, devidamente destinados à exportação.
Por fim, em relação aos créditos presumidos previstos no art. 34 da Lei nº 10.925/2004, diz que não merece prosperar o entendimento da fiscalização de que a requerente estaria enquadrada na hipótese de vedação do parágrafo 1º do referido dispositivo, eis que, supostamente, ela industrializaria apenas bovinos vivos das posições 01.02, 02.01 e 02.02 da NCM. Nesse sentido alega: que industrializa outros produtos além daqueles descritos no parágrafo 1º do art. 34; que a apuração do crédito presumido nos termos acima é realizada pela requerente apenas nas hipóteses de aquisição de cortes e carcaças (classificados nos códigos 0201 e 0202 da NCM), nos exatos termos exigidos no caput do art. 34, empregados em outros produtos que não aqueles listados nas 01.02, 02.01 e 02.02 da NCM, tais como os produtos classificados nos códigos 02.06.10.00, 02.06.20, 02.06.21, 02.06.29 e 15.02.00.1, 41.01.20.10, 41.04.11.24, 41.04.41.30 da NCM.
Despesas de aluguel com máquinas e equipamentos
Contra à glosa dos alugueis de veículos a Interessada alega que os chamados ""Caminhões Munck"" ou ""guindautos"", não são somente veículos, mas máquinas com um guindaste acoplado utilizadas para movimentar os animais e os materiais essenciais ao processo produtivo da requerente, sendo sua semelhança com um veículo tão somente funcional, qual seja, a capacidade de locomoção. E que o aluguel desses e de empilhadeiras elétricas e outros equipamentos utilizados nas atividades da requerente, está em estrita observância ao disposto no inciso IV, do art. 3º, da Lei n. 10833/2003; cita: ""ALUGUEL EMPILHADEIRA ELÉTRICA"" e ALUGUEL VEICULO CARGA"", dentre outros.
Despesas com armazenagem e frete nas operações de venda
A Recorrente inicialmente aponta a precariedade do trabalho fiscal que glosou todos os gastos com serviços de frete, limitando-se a alegar a ausência de vinculação entre as notas fiscais de venda e o conhecimento de transporte, quando, segundo alega, restou comprovado, pelos arquivos apresentados pela requerente no curso do procedimento fiscal, que efetivamente ocorreram dispêndios desta natureza geradores de crédito.
Reclama que a alegação da Fiscalização foi no sentido de que não seria possível afirmar que os fretes em questão seriam efetivamente relacionados à venda de mercadorias. Mas que, além dos fretes de venda, tem direito a crédito em relação a fretes naaquisição de insumo e fretes de insumos e produtos acabados entre estabelecimentos da requerente.
Aduz que apesar de restar consignado na informação fiscal que ""não foram alterados os valores relativos à armazenagem"", verificou-se, pela análise das planilhas apresentadas pela fiscalização, glosas relativas a despesas incorridas a tal título. Defende, assim, que são indevidas as seguintes glosas: ""SERVIÇO ARMAZENAGEM"" (código do produto 808592), lançados na linha 7 do DACON (""despesas de armazenagem e fretes na operação de venda""); bem como, ""MOVIMENTAÇÃO SEPARAÇÃO MERCADORIA SADIA"" (código do produto 920999); ""SERVIÇO CARGA E DESCARGA (TRANSBORDO)"" (código do produto 810135); ""SERVIÇO DE APLICAÇÃO DE STRECH - PALLET"" (código do produto 918832); ""SERVIÇO DE OPERADOR LOGÍSTICO"" (código do produto 928863), lançados de forma equivocada nas linhas 2 e 3 do DACON; dentre outros.
Direito à atualização do crédito postulado pela SELIC
Com fundamento em julgados do STJ, a interessada defende que faz jus à atualização do crédito postulado, mediante remuneração pela taxa Selic.
Inaplicabilidade da multa sobre os débitos compensados
A contribuinte alega que, ainda que se entendesse pela inexistência do direito creditório, nestas situações sobre as quais o fisco já se pronunciou favoravelmente ao creditamento – através de soluções de consulta ou de divergência, tal como das despesas relativas a fretes, peças de reposição de máquinas e equipamentos, dentre outros instrumentos utilizados na produção, além dos serviços para a sua manutenção e dos combustíveis e lubrificantes necessários ao funcionamento das máquinas e equipamentos - não poderia ser cobrada com acréscimos legais atinentes a juros e multa em virtude da não homologação das compensações de débitos com aqueles créditos e nem ser aplicada a multa isolada. Aduz que agiu em cumprimento a essas práticas reiteradas, que são verdadeiras normas complementares das leis tributárias, descabendo, neste caso, a imposição de penalidades e a cobrança de juros, nos termos do art. 100, inciso III, e parágrafo único, do Código Tributário Nacional.
Diante dos argumentos expendidos, a interessa requer que seja julgada procedente a presente manifestação de inconformidade, para o fim de que seja reformado o despacho decisório com o deferimento do pedido de ressarcimento formulado e a homologação das compensações vinculadas. Protesta por provar o alegado por todos os meios de prova admitidos, especialmente a realização de diligências, perícia e a juntada de documentos.
É o relatório.""
A DRJ em Florianópolis (SC) julgou a manifestação de inconformidade improcedente e o Acórdão n° 07-36.510 foi assim ementado:
""ASSUNTO: NORMAS GERAIS DE DIREITO TRIBUTÁRIO
Período de apuração: 31/10/2009 a 31/12/2009
PIS. COFINS. REGIME DA NÃO CUMULATIVIDADE. CRÉDITO. ATUALIZAÇÃO MONETÁRIA E JUROS.
Por expressa previsão legal, não cabe atualização monetária ou incidência de juros sobre o crédito apurado no âmbito do regime não cumulativo de apuração da Contribuição para o PIS/Pasep e da Cofins, passível de utilização através de desconto, compensação ou ressarcimento.
ASSUNTO: PROCESSO ADMINISTRATIVO FISCAL
Período de apuração: 31/10/2009 a 31/12/2009
NULIDADE/ CERCEAMENTO DE DEFESA
Respeitados pela Administração Fazendária os princípios da motivação, do devido processo legal, do contraditório e da ampla defesa, é improcedente é alegação de cerceamento de defesa e nulidade do feito fiscal.
DIREITO DE CRÉDITO. COMPROVAÇÃO. ÔNUS DO CONTRIBUINTE
É do contribuinte o ônus de demonstrar e comprovar ao Fisco a existência do crédito utilizado por meio de desconto, restituição ou ressarcimento e compensação.
DILIGÊNCIA. PERÍCIA.
Em estando presentes nos autos do processo os elementos necessários e suficientes ao julgamento da lide estabelecida, prescindíveis são as diligências e perícias requeridas pelo contribuinte, cabendo a autoridade julgadora indeferi-las.
MATÉRIA INCONTESTE.
O julgador administrativo é impedido de manifestar-se em relação a matéria contra a qual o contribuinte não se manifestou expressamente, pelo que se reputa definitivo, na esfera administrativa, a glosa de crédito na parte relacionada a tal matéria. 
DECISÕES JUDICIAIS E ADMINISTRATIVAS. DESCARACTERIZAÇÃO COMO NORMAS COMPLEMENTARES DA LEGISLAÇÃO TRIBUTÁRIA. 
As decisões judiciais prolatadas em ações individuais não produzem efeitos para outros que não aqueles que compõem a relação processual. E as decisões administrativas, não formalmente dotadas de caráter normativo, igualmente se aplicam inter partes. 
ASSUNTO: CONTRIBUIÇÃO PARA O FINANCIAMENTO DA SEGURIDADE SOCIAL - COFINS 
Período de apuração: 31/10/2009 a 31/12/2009 
COFINS. REGIME DA NÃO CUMULATIVIDADE. HIPÓTESES DE CREDITAMENTO. 
As hipóteses de crédito no âmbito do regime não cumulativo de apuração da Cofins são somente as previstas na legislação de regência, dado que esta é exaustiva ao enumerar os custos e encargos passíveis de creditamento, não estando suas apropriações vinculadas à caracterização de sua essencialidade na atividade da empresa ou à sua escrituração na contabilidade como custo operacional. 
COFINS. REGIME DA NÃO CUMULATIVIDADE. CRÉDITO. CONCEITO DE INSUMO. 
No regime não cumulativo da Cofins somente são considerados como insumos, para fins de creditamento de valores: os combustíveis e lubrificantes, as matérias primas, os produtos intermediários, o material de embalagem e quaisquer outros bens que sofram alterações, tais como o desgaste, o dano ou a perda de propriedades físicas ou químicas, em função de sua aplicação direta na prestação de serviços ou no processo produtivo de bens destinados à venda; e os serviços prestados por pessoa jurídica, aplicados ou consumidos na prestação de serviços ou na produção ou fabricação de bens destinados à venda. 
COFINS. REGIME DA NÃO CUMULATIVIDADE. PARTES E PEÇAS PAR REPOSIÇÃO. CONDIÇÃO DE CREDITAMENTO. 
As partes e peças de reposição aplicadas em máquinas e equipamentos podem ser considerados insumos para fins de creditamento na sistemática não cumulativa da Cofins, desde que as máquinas e equipamentos em que foram utilizadas sejam diretamente utilizados no processo produtivo do bem destinado à venda e desde que não repercutam em aumento, superior a um ano, de vida útil do bem. 
COFINS. REGIME DA NÃO CUMULATIVIDADE. COMBUSTÍVEIS E LUBRIFICANTES. CONDIÇÃO DE CREDITAMENTO. 
No regime não cumulativo da Cofins ss aquisições de combustíveis e lubrificantes geram crédito desde que tais produtos sejam diretamente utilizados nas máquinas e equipamentos utilizados no processo produtivo da empresa. 
COFINS. REGIME DA NÃO CUMULATIVIDADE. SERVIÇO DE MANUTENÇÃO. CONDIÇÃO DE CREDITAMENTO. 
Os serviços de manutenção de máquinas e equipamentos podem ser considerados insumos para fins de creditamento na sistemática não cumulativa da Cofins, entretanto, desde que as máquinas e equipamentos em que são aplicados sejam diretamente utilizados no processo produtivo do bem destinado à venda. 
COFINS. NÃO CUMULATIVIDADE. AQUISIÇÃO INSUMO COM SUSPENSÃO. CRÉDITO PRESUMIDO. 
Comprovado que a venda Leite in Natura e outros produtos agropecuários ocorreu com o benefício da suspensão da Cofins, prevista no art. 9º da nº10.925/2004, inexiste a possibilidade de cálculo de créditos com base nos disposto nos art. 3º da Lei nº 10.833/2003, respectivamente, pelo adquirente dos insumos, havendo previsão legal apenas de crédito presumido, nos termos do disposto no art. 8º da Lei nº 10.925/2004. 
COFINS. REGIME DA NÃO CUMULATIVIDADE. DESPESAS COM FRETES. CONDIÇÃO DE CREDITAMENTO. 
No âmbito do regime não cumulativo da Cofins, as despesas com serviços de frete somente geram crédito quando: o serviço consista de insumo; o frete contratado esteja relacionado a uma operação de venda, tendo as despesas sido arcadas pelo vendedor; o frete contratado esteja relacionado a uma operação de aquisição de insumo, tendo as despesas sido arcadas pelo adquirente. 
COFINS. REGIME DA NÃO CUMULATIVIDADE. ALUGUEIS DE VEÍCULO. CRÉDITO INEXISTENTE. 
A hipótese de crédito prevista no art. 3º, inciso IV, da Lei nº 10.833/2003, somente contempla alugueis “prédios, máquinas e equipamentos”, não se aplicando a alugueis “veículos”. 
COFINS. NÃO CUMULATIVIDADE. AGROINDÚSTRIA. CRÉDITO PRESUMIDO. APURAÇÃO. 
No âmbito do regime não cumulativo da Cofins, a natureza do bem produzido pela empresa que desenvolva atividade agroindustrial é considerada para fins de aferir seu direito ao aproveitamento do crédito presumido, já no cálculo do crédito deve ser observada a alíquota conforme a natureza do insumo adquirido. 
COFINS. NÃO CUMULATIVIDADE. AGROINDÚSTRIA. CRÉDITO PRESUMIDO. APURAÇÃO. 
Nos termos do artigo 34 da Lei nº 12.058/2009, caput e § 1º, em sua redação original, a pessoa jurídica tributada pelo Lucro Real fazia jus a créditos presumidos da Cofins referentes às mercadorias adquiridas no mercado interno com a suspensão prevista no inciso II do art. 32, da mesma lei, e destinadas à revenda ou industrialização, desde que as receitas das vendas desses bens ou das vendas das mercadorias produzidas a partir deles não se sujeitassem a esta mesma suspensão.
Manifestação de Inconformidade Improcedente
Direito Creditório Não Reconhecido""
Inconformado, o contribuinte apresentou recurso voluntário, no qual, basicamente, repisa os argumentos contidos na manifestação de inconformidade.
A Procuradoria Geral da Fazenda Nacional apresentou contrarazões, por meio das quais pretendeu robustecer os argumentos da fiscalização e da DRJ e requereu que seja negado provimento ao recurso voluntário.
É o relatório.

",1
