Decisao,Relatorio,S157VO
9303-003.812,"
Tratam-se de Recursos Especial interpostos pela Fazenda Nacional e pela Doux Frangosul S.A. Agro Avícola Industrial contra o Acórdão nº 3402-002.333, da 2ª Turma Ordinária da 4ª Câmara da 3ª Seção do Conselho Administrativo de Recursos Fiscais, que, por maioria de votos, deu provimento parcial ao Recurso Voluntário para admitir o ressarcimento/compensação dos créditos presumidos de PIS e Cofins não cumulativos e para determinar a aplicação da alíquota de 60% aos insumos utilizados para industrialização dos produtos previstos no §1º do art. 8º da Lei nº 10.925/2004. 

Em vista da decisão, foi consignado, então, no acórdão recorrido a seguinte ementa:
“ASSUNTO: NORMAS GERAIS DE DIREITO TRIBUTÁRIO
Período de apuração: 01/04/2009 a 30/09/2009
Ementa:
NULIDADE. PRESSUPOSTOS.
Ensejam a nulidade apenas os atos e termos lavrados por pessoa incompetente e os despachos e decisões proferidos por autoridade incompetente ou com preterição do direito de defesa.
AGROINDÚSTRIA. RESSARCIMENTO. POSSIBILIDADE.
A Lei nº. 12.058/2009 permitiu o ressarcimento e a compensação dos créditos presumidos apurados na forma do § 3º do art. 8º da Lei 10.925, de 23 de julho de 2004.
AGROINDÚSTRIA. PERCENTUAL DO CRÉDITO PRESUMIDO.
O montante de crédito presumido é determinado pela aplicação da alíquota de 60% (sessenta por cento) quando se tratar de insumos utilizados nos produtos de origem animal classificados nos Capítulos 2 a 4, 16, e nos códigos 15.01 a 15.06, 1516.10, e as misturas ou preparações de gorduras ou de óleos animais dos códigos 15.17 e 15.18.
NÃO CUMULATIVIDADE. RESSARCIMENTO DE SALDO CREDOR.
ATUALIZAÇÃO MONETÁRIA E JUROS.
O artigo 15, combinado com o artigo 13, ambos da Lei nº 10.833, de 2003, vedam expressamente a aplicação de qualquer índice de atualização monetária ou de juros para este tipo de ressarcimento.”

Para melhor compreensão dos pontos apreciados naquele julgamento, importante trazer breve histórico do ocorrido:
O sujeito passivo teve lavrado contra si auto de infração para a exigência de crédito tributário referente ao PIS e à Cofins por suposta infração à legislação tributária em face de solicitação de crédito em PERDCOMP em valores superiores àqueles efetivamente existentes; 
As infrações detectadas, tanto para a Cofins quanto para o PIS/Pasep foram as seguintes: (i) erro no cálculo do valor do crédito presumido agropecuário; (ii) erro na determinação da base de cálculo da contribuição; (iii) erro na determinação dos créditos referentes a fretes na venda de mercadorias;
A recorrente apresentou impugnação, trazendo, entre outros, necessidade de apreciação deste processo relativo aos autos de infração com os referentes às DCOMPs e que, na apuração do montante do crédito presumido, o percentual de 60% foi aplicado corretamente, uma vez que a contribuinte é produtora de mercadorias de origem animal classificada no capítulo 2 da NCM e destinada à alimentação humana ou animal; 
A DRJ/MS julgou a impugnação improcedente, nos termos do Acórdão nº 04-24377, cuja ementa foi assim vazada:
“ASSUNTO: CONTRIBUIÇÃO PARA O FINANCIAMENTO DA SEGURIDADE SOCIAL COFINS
Período de apuração: 01/04/2009 a 30/09/2009
JULGAMENTO CONJUNTO. AUTOS DE INFRAÇÃO, PEDIDOS DE RESSARCIMENTO E DECLARAÇÕES DE COMPENSAÇÃO.
Impugnação a auto de infração sem crédito e lavrado em face de apuração de crédito utilizado em PER/DCOMPs deve ser julgada em conjunto com as manifestações de inconformidade aos despachos decisórios.
MATÉRIA DE FATO NÃO IMPUGNADA.
Considera-se não impugnada a matéria que não tenha sido expressamente contestada.
INCONSTITUCIONALIDADE E ILEGALIDADE.
Os preceitos constitucionais são endereçados ao legislador e a análise de normas segundo esses princípios é atribuição do Poder Judiciário, cabendo aos agentes fazendários o cumprimento da legislação em vigor.
NULIDADE.
O lançamento calcado na legislação aplicável não é nulo e se a contribuinte demonstrou ter pleno conhecimento da infração que lhe é imputada não há que se falar em cerceamento do direito de defesa.
PRODUÇÃO DE PROVAS. PEDIDO DE PERÍCIA.
No âmbito do Processo Administrativo Fiscal as provas devem ser apresentadas junto com a impugnação e a perícia só é determinada no caso de questões que demandem essa providência.
CRÉDITO PRESUMIDO. PERCENTUAL.
A classificação contida no § 3º do art. 8º da Lei n. 10.925/2004 refere-se aos produtos adquiridos como insumos.
CRÉDITO PRESUMIDO. DEMONSTRAÇÃO.
O crédito presumido agroindustrial não é ressarcível, não podendo, para fins de demonstração, ser somado aos créditos passíveis de.
CRÉDITOS. FRETES SOBRE VENDAS.
Os fretes sobre vendas só geram créditos se os pagamentos forem efetuados a pessoa jurídica domiciliada no país e para dedução das contribuições a pagar. 
CRÉDITOS. VALORAÇÃO.
A valoração dos créditos é efetuada na forma disposta na legislação, não incidindo juros compensatórios no caso de ressarcimento de créditos de Cofins, inclusive durante o prazo de discussão administrativa.
CONTRIBUIÇÃO PARA O PIS/PASEP.
Aplicam-se à contribuição para o PIS/Pasep os mesmos argumentos expendidos quanto à Cofins, em face da similitude dos motivos do lançamento e das razões de impugnação. COFINS. ERRO MATERIAL.
Considera-se como correto o valor constante no auto de infração e não aquele do relatório de ação fiscal.”
A recorrente, por conseguinte, apresentou Recurso Voluntário, o qual, foi provido parcialmente para admitir o ressarcimento/compensação dos créditos presumidos de PIS e de Cofins não cumulativos e para determinar a aplicação da alíquota de 60% aos insumos utilizados para industrialização dos produtos previstos no §1º do art. 8º da Lei 10.925/04.

Irresignada, após apreciação da matéria pela 2ª Turma Ordinária da 4ª Câmara da 3ª Seção do Conselho Administrativo de Recursos Fiscais, a Fazenda Nacional interpôs Recurso Especial requerendo a reforma da decisão recorrida que, por sua vez:
 Possibilitou que o crédito presumido da agroindústria previsto no art. 8º da Lei 10.925/04 poderia ser objeto de pedido de ressarcimento ou compensação, pois entende que não haveria supedâneo legal autorizando tal pedido;
Determinou a aplicação da alíquota de 60% aos insumos utilizados para industrialização dos produtos previstos no art. 8º, § 1º, da Lei 10.925/04, pois entende que o percentual deveria ser definido em função dos insumos adquiridos, e não dos produtos fabricados.

O apelo da Fazenda Nacional foi admitido integralmente, nos termos do Despacho de fls. 1997/1999 apreciado pelo Presidente em exercício da 3ª Seção desse Conselho.

O Despacho traz, entre outros, que foi comprovada a divergência jurisprudencial, propondo, então, o seguimento ao recurso da Fazenda Nacional.

Continuando, insatisfeito também com a decisão proferida pelo Colegiado da 2ª Turma da 4º Câmara da 3ª Seção do CARF, o sujeito passivo interpôs Recurso Especial de fls. 2025/2059, insurgindo-se, entre outros, contra decisão que afastou:
O direito ao crédito presumido de PIS/Cofins não cumulativo, sob o argumento de que, ainda que as empresas que realizaram frete ao sujeito passivo possuíssem sede no exterior, elas apresentavam domicílio no Brasil;
A aplicação da correção monetária e juros quando do ressarcimento/compensação do saldo credor. 

O apelo do sujeito passivo foi admitido integralmente, nos termos do Despacho de fls. 2154/2155 apreciado pelo Presidente em exercício da 4ª Câmara da 3ª Seção desse Conselho.

O Despacho traz, entre outros, que foi comprovada a divergência jurisprudencial, propondo, então, o seguimento ao recurso do sujeito passivo.

Ademais, considerando o despacho de admissão do Recurso Especial interposto pela Fazenda Nacional, o sujeito passivo apresentou Contrarrazões de fls. 2100/2128 a esse recurso, requerendo que seja acolhida a preliminar de nulidade ou, subsidiariamente, a de suspensão do processo, devendo, caso ultrapassada, ser o referido recurso não conhecido e, caso conhecido, que lhe seja negado provimento pela Câmara Superior de Recursos Fiscais – pelos fundamentos que ora expõe nesse documento.
 
A Fazenda Nacional também apresentou Contrarrazões de fls. 2157/2162 ao Recurso Especial interposto pelo sujeito passivo, trazendo, relativamente:
Ao crédito decorrente do pagamento de frete internacional, que o serviço de transporte marítimo internacional é prestado por pessoa jurídica domiciliada no exterior e o pagamento, ainda que realizado no Brasil, a agentes marítimos, é transferido, imediatamente, para a empresa que realiza aquele transporte. Quem presta o serviço de fato contratado pela ora recorrente (de frete na exportação) é a empresa estrangeira, ou seja, o serviço em questão não é adquirido de pessoa jurídica aqui domiciliada, mas de empresas estrangeiras que efetivamente transportam as mercadorias da fiscalizada para os países importadores;
À aplicação da Taxa Selic no ressarcimento de créditos de PIS e Cofins na sistemática não cumulativa, pelo teor dos dispositivos legais e normativos, não há previsão na legislação tributária de qualquer acréscimo, sendo, em conclusão, indevida a admissão da Taxa SELIC pela autoridade administrativa.

É o relatório.
",1
