9303-003.385,"Trata-se de recursos especiais do Contribuinte e da Fazenda Nacional por meio do qual se busca a reforma do Acórdão nº 202-16.397, eis sua ementa:
CPMF. HIPÓTESE DE INCIDÊNCIA.
Constitui fato gerador da CPMF, nos termos da legislação de regência, o lançamento a débito, por instituição financeira, em conta corrente de depósito junto a ela mantida.
ALÍQUOTA ZERO. APLICAÇÃO.
A aplicação da alíquota zero prevista no art. 8º, inc. III, da Lei nº 9.311/1996 restringe-se às atividades e operações relacionadas em ato do Ministro da Fazenda, dentre as que constituam objeto social da instituição contribuinte, a teor do disposto no § 3º do mesmo artigo.
Não preenchem os requisitos para o gozo do beneficio da ""alíquota zero"", os lançamentos efetuados em conta-corrente de Distribuidora de Títulos e Valores Mobiliários, decorrentes da prestação de serviços gestão de caixa relativa a recebimentos, pagamentos ou tratamento de valores a clientes preferenciais do Banco.
JUROS DE MORA CRÉDITO TRIBUTÁRIO. TAXA SELIC. 
É cabível, no lançamento de oficio, a cobrança de juros de mora sobre o tributo ou contribuição, calculados com base na variação acumulada da Taxa Selic. Referidos juros não incidem sobre a multa de oficio lançada juntamente com o tributo ou contribuição, decorrente de fatos geradores ocorridos a partir de 19/01/1997, por absoluta falta de previsão legal.
Recurso parcialmente provido.
Como é possível extrair da ementa, o colegiado manteve parcialmente a exigência fiscal, ratificando a cobrança da CPMF exigida de ofício e afastando a incidência de juros de mora sobre multa de ofício. A primeira questão foi decidida pelo voto de qualidade e a segunda, por unanimidade de votos.
Os fatos que deram ensejo à exigência fiscal litigiosa, escorada na acusação de utilização indevida da alíquota zero prevista no Inciso III do art. 8º da Lei nº 9.311, de 1996, foram descritos no Termo de Verificação Fiscal às fls. 74 a 84 e podem ser resumidos nos excertos transcritos a seguir (original não destacado):
a) A BANKBOSTON DTVM S/A firmou com grandes clientes contrato denominado ""Contrato de Prestação de Serviços de Assessoria e Assistência Financeira"", cujo objeto é a . gestão de caixa relativa a pagamentos (cash management).
b) Para a consecução da ""gestão de caixa"" acima, os clientes transferiam recursos de suas contas correntes mantidas junto ao Bankboston Banco Múltiplo para a conta corrente de depósito à vista da DTVM. Em alguns casos, listados pelo contribuinte e que foram objeto de autuação por esta fiscalização, os recursos eram provenientes de recolhimento de numerários ou cheques pré-datados custodiados pelo Banco Múltiplo, sem trânsito pela conta corrente de depósitos dos titulares junto ao Bankboston.
c) A DTVM contratava o Bankboston Banco Múltiplo S/A, na qualidade de ""banco correspondente"", para gerenciar as obrigações de seus clientes. O Bankboston recebia os títulos e as obrigações para liquidação nas datas previstas.
d) Na data de vencimento das obrigações, o Bankboston debitava a conta corrente da DTVM para emissão de cheques administrativos diretamente para pagamento dos compromissos dos clientes.
e) O Bankboston pagava a título de ""Prêmio pela Preferência"" remuneração aos clientes.
Detalha, ainda, o TVF:
""A DTVM prestava um serviço de ""gestão de caixa"" para seus clientes, normalmente regido por ""Contrato de Prestação de Serviços e Assessoria Financeira"", que consistia na efetivação de recebimentos e pagamentos dos seus clientes. Para executar os serviços previstos contratualmente, a DTVM subcontratava o Bankboston Banco Múltiplo, na qualidade de Banco correspondente, que era a instituição financeira que efetivamente prestava o serviço de gestão de caixa e, inclusive, pagava um prêmio pela preferência aos seus clientes.
Os recursos dos clientes relacionados às operações de “payments” eram provenientes de três serviços oferecidos pelo banco, a saber: recolhimento de numerário (RN), cheques pré datados custodiados pelo banco (Safety Check) e valores provenientes de débitos em contas correntes dos titulares. Esses recursos eram registrados em contas transitórias da instituição financeira Bankboston, e posteriormente, creditados na conta corrente da DTVM (nº 00.5100.00). Na data estabelecida tais valores eram debitados na conta da DTVM e utilizados para a liquidação das obrigações dos clientes, através dos cheques administrativos ou DOC relacionados nas listagens apresentadas pelos contribuintes.
Argumenta, assim que os serviços de gestão de pagamentos não se inseriam entre aqueles que constituem o objeto social das Distribuidoras de Títulos e Valores Mobiliários - DTVM, definido nos termos do art. 2º da Resolução Bacen nº 1.653, de 26/10/89.
Conclui, nessa esteira, que os lançamentos a débito na conta-corrente da DTVM representariam fatos geradores da CPMF e deveriam ser alvo de tributação
Em suas razões de impugnação, após transcrever o Termo de Verificação Fiscal (TVF) e pontuar os elementos que, no seu sentir, comporiam a acusação do Fisco, a Contribuinte impugnou a integralidade do lançamento.
Defende, inicialmente, que nos moldes em que foram praticadas, as operações não representaram prejuízo ao Erário ou vantagem ao Bankboston DTVM, que não aferiria qualquer benefício relativo à CPMF, como seria possível concluir a partir da própria descrição do objeto dos Contratos consignados no TVF. Transcreve excertos do instrumento contratual.
Segundo alega, no período entre o débito do valor da conta corrente dos clientes e o efetivo pagamento de suas obrigações o montante debitado não permanecia em poder da DTVM, mas sim com a Contribuinte, contabilizado na rubrica “conta de correspondente no país – DTVM”. Posteriormente, à medida em que ocorreria o vencimento daquelas obrigações, os recursos seriam transferidos para a conta-corrente da DTVM, para que fosse gerado um cheque administrativo, referente ao pagamento da obrigação. Esta seria a vantagem auferida pela Contribuinte (não da DTVM) e a razão do pagamento do “prêmio de preferência”, previsto nos contratos e regulamentado pela Circular nº 2.535/95, art. 2º, do BACEN. Transcreve dispositivo.
Afirma, outrossim, que não haveria prejuízo para o Erário, pois a CPMF devida pelo débito relativo à quitação das dívidas seria regularmente paga, quando da transferência de valores para a DTVM. 
Defende, nessa linha, que, a prevalecer a cobrança litigiosa estar-se-ia onerando com a incidência de CPMF uma operação já tributada. 
Ademais, a contratação da DTVM proporcionaria a esta deter informações necessárias otimização das disponibilidades financeiras de seus clientes e, consequentemente, oferecer alternativas de investimento adequadas ao seu fluxo de caixa. Pugna pelo reconhecimento das condições para incidência da alíquota zero.
Acrescenta, nessa linha, após transcrever a legislação de regência, que o objeto contratual questionado (gestão de caixa) encontrar-se-ia inserido no seu objeto societário, já que não se restringiria à realização de recebimentos e pagamentos, envolveria desde a análise e escolha da instituição financeira, até o constante acompanhamento do fluxo de receitas de que dispõe o cliente, com vistas a compor uma carteira de investimentos, atividade complementar e consentânea com o objeto social usual de qualquer sociedade distribuidora de títulos e valores mobiliários.
Pontua, outrossim, que a Bankboston DTVM celebraria contratos como os que aqui se discute há 10 anos e tal procedimento jamais teria sido questionado pelo Banco Central do Brasil, órgãos cujo rigor seria notório. Certamente não cabe à fiscalização tributária efetuar tal sindicância com vistas exclusivamente a uma maior arrecadação de CPMF. 
Anexa parecer do ilustre consultor Luiz Carlos Sturzenegger, ex-Procurador Chefe da Fazenda Nacional e Diretor do Banco Central do Brasil, ratificando seu entendimento acerca do enquadramento das atividades questionadas no objeto societário da Bankboston DTVM, nos termos da legislação de regência (Resolução BACEN nº 1.120, de 1986, que teve sua redação alterada pela Resolução BACEN nº 1.653, de 1989).
Questiona a utilização da taxa referencial do Sistema Especial de Liquidação e de Custódia – SELIC, que julga imprestável para cálculo de juros de mora: ""além de ser figura híbrida, composta de correção monetária, juros e valores correspondentes a remuneração de serviços das instituições financeiras, é fixada unilateralmente por órgão do poder executivo e, ainda, extrapola em muito o percentual de 1% previsto no artigo 161 do CTN.""
A exigência foi ratificada pela Delegacia da Receita Federal do Brasil de Julgamento em São Paulo, nos termos da seguinte ementa:
Assunto: Contribuição Provisória sobre Movimentação ou Transmissão de Valores e de Créditos e Direitos de Natureza Financeira - CPMF
Período de apuração: 02/01/1998 a 30/12/1999
Ementa: CPMF. FATO GERADOR.
Constitui fato gerador da CPMF, nos termos da legislação de regência, o lançamento a débito, por instituição financeira, em contas correntes de depósito junto a ela mantida.
CPMF. ALÍQUOTA ZERO. APLICAÇÃO.
A aplicação da alíquota zero prevista no artigo 8º, inciso III, da Lei nº 9.311/1996 restringe-se às atividades e operações relacionadas em ato do Ministro da Fazenda, dentre as que constituam objeto social da instituição contribuinte. Não preenchem os requisitos para o gozo do benefício da “alíquota zero”, os serviços prestados pela Distribuidora de Títulos e Valores Mobiliários, cliente do Banco, por intermédio dos “Contratos de Prestação de Serviços de Assessoria e Assistência Financeira”.
TAXA SELIC. APLICABILIDADE.
A utilização da taxa SELIC para o cálculo dos juros de mora decorre de lei, sobre cuja aplicação não cabe aos órgãos do Poder Executivo deliberar.
Sobreveio recurso voluntário onde a Contribuinte, essencialmente, contesta a decisão de primeira instância sob os mesmos fundamentos expendidos contra o auto de infração, acrescendo ao seu reclame suposta omissão do aresto, com relação aos seguintes pontos, bem resumidos pelo acórdão de segunda instância em análise:
No recurso voluntário, o interessado reclama que a decisão recorrida não teria levado em conta os seguintes argumentos de extrema importância para o deslinde da questão:
- que as contratações da DTVM não visavam a obtenção de qualquer beneficio em relação à CPMF, pois que contratos idênticos já eram celebrados em 1993, conforme prova juntada aos autos;
- que não houve prejuízo para o Erário, pois a CPMF, que seria devida caso o pagamento das dívidas fosse efetuado diretamente pelo cliente, é regularmente paga quando do débito dos valores correspondentes de sua conta corrente;
A exigência, como antecipado, foi parcialmente mantida pelo acórdão submetido a este Colegiado
Regularmente cientificada, a Procuradoria-Geral da Fazenda Nacional (PGFN) interpôs embargos de declaração, mas tais embargos foram rejeitados por despacho do Presidente do Colegiado.
Inconformada, a PGFN apresenta recurso especial de divergência, com base na previsão regimental vigente à época, relativamente a duas matérias: suposto julgamento de matéria não impugnada ou recorrida (preclusa) e legalidade da imposição de juros de mora sobre a multa de ofício, sendo tal recurso recebido exclusivamente com relação à segunda matéria.
Em síntese, o recurso especial da Fazenda Nacional está concentrado na argumentação de que o acórdão em exame teria se limitado à empreender uma interpretação literal da legislação de regência e concluíra, equivocadamente no seu sentir, que o arts. 61, § 3º e 43 da Lei nº 9.430, de 1996 e do 161, caput e § 1º do CTN não dariam respaldo à correção monetária sobre a multa de ofício.
Sustenta, em seu recurso, portanto, que a análise sistemática dos dispositivos, em conjunto com os arts. 113, §1º e 139 do CTN, permitiria concluir que a multa teria a mesma natureza da obrigação principal e, como tal, representaria um crédito tributário, passível de correção nos termos dos artigos considerado inaplicáveis pelo acórdão recorrido.
Ademais, não se poderia limitar a aplicação do 30 da Lei nº 10.522, de 2002 a créditos relativos a fatos geradores aperfeiçoados até 31/12/1994. O dispositivo não estabeleceria uma limitação temporal, mas a sua aplicação da Selic a todos os débitos para com a União.
Procedida à regular ciência, o Contribuinte oferece contrarrazões ao recurso da PGFN, além do seu recurso especial, relativamente à fração que restou vencido.
Aduz a contribuinte, em primeiro lugar, que o primeiro paradigma relacionado (nº 101-96.177) não se prestaria à comprovação da divergência, em razão de que teria apreciado legislação diversa da que aqui se discute, no caso, fatos geradores relativos aos anos-calendário 1991 e 1992, tanto que, nos termos da sua ementa, ressalvara a aplicação da taxa Selic a fatos geradores ocorridos até 31/12/1994. Transcreve referida ementa. 
Acrescenta, nessa toada, que os artigos 29 e 30 da MP 1621-31/1998, invocados pela Procuradoria da Fazenda Nacional como fundamento para a cobrança de juros sobre multa, teriam sido afastados para fatos gerados posteriores a 1997.
Arremata, alegando que o acórdão apontado como paradigma teria enfrentado a discussão sob enfoque diverso.
Da mesma forma, não haveria que se falar em divergência de interpretação relativamente ao segundo paradigma (Acórdão 103-22.197), que trataria da matéria em uma única linha. Transcreve excerto.
Sustenta que o paradigma não se prestaria a comprovar a alegada divergência em razão de que não constaria do acórdão as razões que teriam conduzido à conclusão de que haveria incidência de juros sobre multa de ofício.
Conclui aduzindo que a Fazenda Nacional não teria demonstrado fundamentadamente a divergência, limitando-se a transcrever, no corpo do recurso, as ementas dos acórdãos apontados como paradigmas, sem a demonstração precisa dos pontos de divergência entre esses acórdãos e o acórdão recorrido. 
Passando ao mérito de suas contrarrazões, a Contribuinte passa a defender a manutenção da decisão de afastar a cobrança da Taxa Selic sobre multa de ofício. Essencialmente, trilha o mesmo caminho do acórdão recorrido e ataca a linha argumentativa da PGFN. 
No recurso especial, o Contribuinte, após transcrever excertos do auto de infração litigioso e resumir as etapas percorridas pelo presente processo, o contribuinte passa a expor a divergência que sustentaria seu prosseguimento, e, no mérito, seu provimento.
Destaca, inicialmente, que as operações que deram ensejo à cobrança litigiosa decorreriam da prestação de serviços de assessoria na gestão de pagamentos por meio de bancos comerciais, que alega atrelados ao objeto societário da pessoa jurídica Bankboston DTVM. Passa a transcreve excertos do TVF e, em seguida, do voto-condutor do acórdão recorrido e expõe sua convicção no sentido de que a interpretação sedimentada no aresto contrariaria divergiria da que foi dada pela 3ª Câmara do Segundo Conselho de Contribuintes, no Acórdão 203-12.493, cuja ementa transcreve parcialmente.
Relata que, naquele caso, a Santander DTVM S/A firmara com clientes do Banco Santander S/A, contratos que teriam objeto idêntico aos do que aqui se discute e, diferentemente do presente recurso, o colegiado prolator do acórdão paradigma afastou a exigência de CPMF sob a alegação de que os serviços de gestão de pagamentos atenderiam aos requisitos da Resolução nº 1.653/89 e da Portaria MF nº 134/89. Consequentemente, as operações fariam jus à alíquota zero. Transcreve excertos do voto-condutor do paradigma que exporiam essas razões e da declaração de voto apresentada, que trilha raciocínio idêntico.
No mérito, o recurso especial explora, essencialmente, a mesma linha argumentativa da impugnação e do recurso voluntário, reforçada a partir da transcrição de excertos do voto-condutor do acórdão paradigma e da jurisprudência do Primeiro Conselho de Contribuintes acerca da necessidade de observância da interpretação sedimentada pelo Banco Central do Brasil, no âmbito das suas atribuições. 
No prazo oferecido para contrarrazoar, a Fazenda Nacional pugna pela negativa do recurso especial do contribuinte 
É o Relatório.
",1
